dlg_no,a,b,c,d,e,f
0,Добрый день,Менеджер не представился,Дмитрий,Диджитал Бизнес,Менеджер не попрощался,Условие не выполнено
1,Да здравствуйте когда заканчивается,Менеджер не представился,Дмитрий,Диджитал Бизнес,Менеджер не попрощался,Условие не выполнено
2,Здравствуйте,Менеджер не представился,Айдар,Диджитал Бизнес,Менеджер не попрощался,Условие не выполнено
3,Добрый день,Менеджер не представился,Имя менеджера не называлось,Китобизнес,Да до свидания,Менеджер поздоровался и попрощался
4,Менеджер не поздоровался,Менеджер не представился,Имя менеджера не называлось,Компания клиента не упоминалась,Угу да до свидания,Условие не выполнено
5,Да да да здравствуйте анастасия меня слышно да хорошо,Менеджер не представился,Дмитрий,Компания клиента не упоминалась,Менеджер не попрощался,Условие не выполнено
